{
  "$schema": "http://json-schema.org/draft-07/schema#",
  "title": "profile-forge config.json",
  "description": "Everything is optional. Flags / action inputs override this file; unset keys use the defaults shown.",
  "type": "object",
  "additionalProperties": false,
  "definitions": {
    "str": { "type": "string" },
    "strs": { "type": "array", "items": { "type": "string" } },
    "hex": { "type": "string", "pattern": "^#?([0-9a-fA-F]{3,4}|[0-9a-fA-F]{6}|[0-9a-fA-F]{8})$" },
    "colors": {
      "type": "object",
      "additionalProperties": false,
      "description": "Color overrides. Hex with or without #. bg_gradient is \"angle,color1,color2,...\".",
      "properties": {
        "bg_color": { "$ref": "#/definitions/hex" }, "panel_color": { "$ref": "#/definitions/hex" }, "border_color": { "$ref": "#/definitions/hex" },
        "text_color": { "$ref": "#/definitions/hex" }, "muted_color": { "$ref": "#/definitions/hex" }, "title_color": { "$ref": "#/definitions/hex" },
        "icon_color": { "$ref": "#/definitions/hex" }, "ring_color": { "$ref": "#/definitions/hex" }, "fire_color": { "$ref": "#/definitions/hex" },
        "track_color": { "$ref": "#/definitions/hex" }, "stroke_color": { "$ref": "#/definitions/hex" },
        "currStreakNum": { "$ref": "#/definitions/hex" }, "sideNums": { "$ref": "#/definitions/hex" }, "currStreakLabel": { "$ref": "#/definitions/hex" },
        "sideLabels": { "$ref": "#/definitions/hex" }, "dates": { "$ref": "#/definitions/hex" }, "excludeDaysLabel": { "$ref": "#/definitions/hex" }, "snakeColor": { "$ref": "#/definitions/hex" }, "frameColor": { "$ref": "#/definitions/hex" },
        "levelE": { "$ref": "#/definitions/hex" }, "levelD": { "$ref": "#/definitions/hex" }, "levelC": { "$ref": "#/definitions/hex" }, "levelB": { "$ref": "#/definitions/hex" }, "levelA": { "$ref": "#/definitions/hex" }, "levelS": { "$ref": "#/definitions/hex" }, "levelTop": { "$ref": "#/definitions/hex" }, "levelX": { "$ref": "#/definitions/hex" },
        "bg_gradient": { "type": "string" }
      }
    },
    "section": { "enum": ["header", "about", "workingOn", "stats", "streak", "languages", "trophies", "heatmap", "techStack", "terminal", "rhythm"] }
  },
  "properties": {
    "$schema": { "type": "string" },
    "user": { "type": ["string", "null"], "description": "GitHub login (the action defaults to the repo owner)." },
    "title": { "type": ["string", "null"], "description": "Shown next to @login." },
    "about": { "$ref": "#/definitions/strs", "description": "Paragraphs for the About panel (**bold** markers are stripped)." },
    "workingOn": {
      "type": "array",
      "items": { "type": "object", "required": ["title"], "properties": { "title": { "type": "string" }, "description": { "type": "string" }, "url": { "type": "string" } } }
    },
    "links": {
      "type": "array",
      "description": "Rendered as separate clickable buttons in <output_dir>/buttons/.",
      "items": { "type": "object", "required": ["label", "url"], "properties": { "label": { "type": "string" }, "url": { "type": "string" }, "icon": { "type": "string" }, "color": { "type": "string" } } }
    },
    "techStack": {
      "type": "array",
      "items": {
        "type": "object", "required": ["category", "items"],
        "properties": { "category": { "type": "string" }, "items": { "type": "array", "items": { "type": "object", "required": ["name", "image"], "properties": { "name": { "type": "string" }, "image": { "type": "string" } } } } }
      }
    },
    "locale": { "enum": ["en", "it", "es", "fr", "de", "pt-br", "ja", "zh"], "default": "en" },
    "timezone": { "type": "string", "default": "UTC", "description": "IANA zone that decides what \"today\" is for streaks." },
    "includePrivate": { "type": "boolean", "default": false },
    "themes": {
      "description": "A list of theme names, or { slot: theme }. A slot decides the file name (profile-forge-<slot>.svg), so { \"dark\": \"dracula\", \"light\": \"gruvbox-light\" } keeps the README <picture> unchanged.",
      "oneOf": [{ "type": "array", "items": { "type": "string" } }, { "type": "object", "additionalProperties": { "type": "string" } }],
      "default": ["dark", "light"]
    },
    "customThemes": {
      "type": "object",
      "description": "Your own themes: { name: { base: <theme>, ...color overrides } }, usable in `themes`.",
      "additionalProperties": { "type": "object", "properties": { "base": { "type": "string" }, "bg_gradient": { "type": "string" } }, "additionalProperties": { "$ref": "#/definitions/hex" } }
    },
    "colors": { "$ref": "#/definitions/colors" },
    "colorsByTheme": { "type": "object", "description": "Color overrides per theme slot.", "additionalProperties": { "$ref": "#/definitions/colors" } },
    "card": {
      "type": "object", "additionalProperties": false,
      "properties": {
        "radius": { "type": "number", "minimum": 0, "maximum": 60, "default": 20 },
        "hideBorder": { "type": "boolean", "default": false },
        "animations": { "type": "boolean", "default": true },
        "background": {
          "type": "object", "additionalProperties": false,
          "properties": {
            "gradient": { "type": ["string", "null"], "description": "angle,color1,color2,... e.g. 35,4158d0,c850c0,ffcc70" },
            "pattern": { "enum": ["none", "dots", "grid", "diagonal"], "default": "none" },
            "glow": { "type": "boolean", "default": true }
          }
        }
      }
    },
    "layout": {
      "type": "array",
      "description": "Section order. A nested pair puts two sections side by side at half width (any two except header).",
      "items": { "oneOf": [{ "$ref": "#/definitions/section" }, { "type": "array", "maxItems": 2, "items": { "$ref": "#/definitions/section" } }] },
      "default": ["header", "about", "workingOn", ["stats", "streak"], "languages", "trophies", "heatmap", "techStack"]
    },
    "grid": {
      "description": "Free layout on a 6-column grid instead of `layout`: each section has a width in columns and falls to the lowest free spot. The height follows the content. Minimum widths: header 6, stats/streak/languages/heatmap 3, the others 2. The optional height can only make a card taller than its content.",
      "oneOf": [
        { "type": "null" },
        {
          "type": "array",
          "items": {
            "type": "object", "additionalProperties": false, "required": ["section"],
            "properties": { "section": { "$ref": "#/definitions/section" }, "cols": { "type": "integer", "minimum": 1, "maximum": 6, "default": 3 },
              "height": { "type": "integer", "minimum": 0, "maximum": 3000, "description": "Card height in pixels. Never shorter than the content needs; omit for automatic." } }
          }
        }
      ],
      "default": null
    },
    "hideSections": { "type": "array", "items": { "enum": ["rank", "header", "about", "workingOn", "stats", "streak", "languages", "trophies", "heatmap", "techStack", "terminal", "rhythm"] } },
    "header": {
      "type": "object", "additionalProperties": false,
      "properties": {
        "avatar": { "enum": ["circle", "rounded", "hide"], "default": "circle" },
        "frame": { "enum": ["none", "ring", "double", "dashed", "neon", "pixel", "glitch", "laurel", "flames", "sakura", "stars", "halo", "aurora", "orbit", "prism", "auto"], "default": "ring", "description": "A decoration around the avatar, like Discord avatar decorations. ring: the classic gradient ring. auto: follows the level (E none, D ring, C double, B dashed, A neon, S flames, SSS aurora, X prism). Colour: colors.frameColor, default the level colour." },
        "flag": { "type": ["string", "null"], "default": null, "description": "Path of a flag image (svg/png, 4:3) drawn under the name, e.g. assets/img/flags/it.svg." },
        "rankStyle": { "enum": ["ring", "hexagon", "shield"], "default": "ring", "description": "The shape of the rank indicator." },
        "rankThickness": { "type": "number", "minimum": 4, "maximum": 16, "default": 8 },
        "frameAnimation": { "enum": ["default", "none", "spin", "pulse", "twinkle"], "default": "default", "description": "default: the frame's own motion. none: still. spin / pulse / twinkle: override it where it makes sense." },
        "facts": { "type": "array", "maxItems": 4, "items": { "enum": ["contributionsThisYear", "bestDay", "busiestWeekday", "currentStreak", "longestStreak", "topLanguage", "stars", "followers"] }, "default": ["contributionsThisYear", "bestDay", "busiestWeekday"] },
        "rankIcon": { "enum": ["level", "percentile", "github"], "default": "level" }
      }
    },
    "stats": {
      "type": "object", "additionalProperties": false,
      "properties": {
        "title": { "type": ["string", "null"] },
        "hide": { "type": "array", "description": "Case, - _ and spaces are ignored at runtime (e.g. pull-requests).", "items": { "anyOf": [{ "enum": ["stars", "commits", "prs", "issues", "reviews", "contributed", "followers", "repos"] }, { "type": "string" }] } },
        "show": { "type": "array", "description": "Extra rows.", "items": { "enum": ["prsMerged", "prsMergedPercentage", "discussionsStarted", "discussionsAnswered"] } },
        "icons": { "type": "boolean", "default": true },
        "numberFormat": { "enum": ["long", "short"], "default": "long" },
        "numberPrecision": { "enum": [0, 1, 2, null], "description": "Fixed decimals for short numbers." },
        "textBold": { "type": "boolean", "default": true },
        "lineHeight": { "type": "number", "minimum": 18, "maximum": 60, "default": 30 },
        "commitsYear": { "type": ["integer", "null"], "minimum": 2005, "description": "Count commits of this year only." },
        "excludeRepos": { "$ref": "#/definitions/strs" }
      }
    },
    "streak": {
      "type": "object", "additionalProperties": false,
      "properties": {
        "title": { "type": ["string", "null"] },
        "hide": { "type": "array", "items": { "enum": ["total", "current", "longest"] } },
        "mode": { "enum": ["daily", "weekly"], "default": "daily" },
        "excludeDays": { "type": "array", "items": { "enum": ["Sun", "Mon", "Tue", "Wed", "Thu", "Fri", "Sat"] } },
        "startingYear": { "type": ["integer", "null"], "minimum": 2005, "description": "First year counted (>= 2005)." },
        "dateFormat": { "type": ["string", "null"], "description": "PHP-style (d j m n M F y Y); text in [...] is hidden for the current year, e.g. \"M j[, Y]\"." },
        "shortNumbers": { "type": "boolean", "default": false },
        "excludeDaysLabel": { "type": "boolean", "default": true }
      }
    },
    "languages": {
      "type": "object", "additionalProperties": false,
      "properties": {
        "title": { "type": ["string", "null"] },
        "layout": { "enum": ["bar", "compact", "donut", "donut-vertical", "pie"], "default": "bar" },
        "count": { "type": "integer", "minimum": 1, "maximum": 20, "default": 8, "description": "Charts (donut/pie) show at most 10 in the legend." },
        "hide": { "$ref": "#/definitions/strs" },
        "excludeRepos": { "$ref": "#/definitions/strs" },
        "hideProgress": { "type": "boolean", "default": false },
        "statsFormat": { "enum": ["percentages", "bytes"], "default": "percentages" },
        "sizeWeight": { "type": "number", "minimum": 0, "maximum": 10, "default": 1 },
        "countWeight": { "type": "number", "minimum": 0, "maximum": 10, "default": 0 }
      }
    },
    "trophies": {
      "type": "object", "additionalProperties": false,
      "properties": {
        "title": { "type": ["string", "null"] },
        "titles": { "$ref": "#/definitions/strs", "description": "Only these trophies (aliases: Star, Commit, Follower, Issue, PR, Repo, Review, Duration, Orgs...)." },
        "hideTitles": { "$ref": "#/definitions/strs" },
        "ranks": { "$ref": "#/definitions/strs", "description": "Only these ranks (E, E+, D-, D … S+, SSS, SECRET; a bare letter means its whole family). A \"-\" prefix drops one, e.g. -E." },
        "hideRanks": { "$ref": "#/definitions/strs" },
        "columns": { "type": "integer", "minimum": -1, "maximum": 12, "default": 0, "description": "0 or -1 = all in one row." },
        "rows": { "type": "integer", "minimum": 0, "maximum": 10, "default": 0, "description": "0 = no limit." },
        "marginW": { "type": "number", "minimum": 0, "maximum": 60, "default": 14 },
        "marginH": { "type": "number", "minimum": 0, "maximum": 60, "default": 14 },
        "padding": { "type": "number", "minimum": 0, "maximum": 60, "default": 20, "description": "Space between the panel edge and the trophies." },
        "align": { "enum": ["center", "left"], "default": "center" },
        "parts": { "type": "array", "items": { "enum": ["title", "label", "score", "bar"] }, "default": ["title", "label", "score", "bar"], "description": "Which texts and the progress bar to show on each trophy." },
        "noBg": { "type": "boolean", "default": false },
        "noFrame": { "type": "boolean", "default": false },
        "extra": { "type": "array", "items": { "enum": ["Issues", "Reviews"] }, "description": "Opt-in trophies." },
        "birthday": { "type": ["string", "null"], "pattern": "^(\\d{4}-)?\\d{2}-\\d{2}$", "default": null, "description": "Your birthday as MM-DD (or YYYY-MM-DD): the Happy Birthday secret trophy shows on that day, in the card's time zone." },
        "sort": { "enum": ["default", "rank", "name"], "default": "default", "description": "default: the order of `titles` (or the built-in order). rank: highest level first, secret trophies after. name: A-Z." },
        "highlight": { "$ref": "#/definitions/strs", "description": "Trophy titles drawn with a pulsing glow." }
      }
    },
    "marquee": {
      "type": "object", "additionalProperties": false, "description": "The Tech stack section: scrolling logos.",
      "properties": {
        "speed": { "type": "number", "minimum": 5, "maximum": 200, "default": 28, "description": "Pixels per second." },
        "rows": { "type": "integer", "minimum": 1, "maximum": 4, "default": 2, "description": "Rows of logos, scrolling in alternating directions." },
        "order": { "enum": ["shuffle", "config", "name"], "default": "shuffle", "description": "shuffle: random at every generation. config: as listed. name: A-Z." },
        "byCategory": { "type": "boolean", "default": false, "description": "Order / shuffle inside each category and keep the categories in sequence, instead of mixing everything." }
      }
    },
    "terminal": {
      "type": "object", "additionalProperties": false, "description": "A terminal window: lines starting with \"$ \" are typed like commands, the others appear as their output.",
      "properties": {
        "title": { "type": ["string", "null"], "default": null, "description": "Window title. Default: <login>@github: ~" },
        "lines": { "$ref": "#/definitions/strs", "default": [] }
      }
    },
    "rhythm": {
      "type": "object", "additionalProperties": false, "description": "When you code: average contributions per weekday and total per month, last 12 months.",
      "properties": {
        "title": { "type": ["string", "null"], "default": null },
        "show": { "type": "array", "items": { "enum": ["weekdays", "months"] }, "default": ["weekdays", "months"] }
      }
    },
    "heatmap": {
      "type": "object", "additionalProperties": false,
      "properties": {
        "mode": { "enum": ["grid", "snake"], "default": "grid", "description": "grid: the plain contribution grid. snake: an animated snake eats the contributions (loops forever, plain CSS)." },
        "snakeLength": { "type": "integer", "minimum": 3, "maximum": 12, "default": 6, "description": "How many cells long the snake is." },
        "snakeStyle": { "enum": ["classic", "rainbow", "glow"], "default": "classic", "description": "classic: the snake colour. rainbow: every segment its own colour. glow: a soft halo around the body." },
        "snakePath": { "enum": ["smart", "busy", "nearest", "sweep", "rows", "spiral"], "default": "smart", "description": "Route of the snake. smart: quietest days first, then busier ones. busy: busiest first. nearest: always the closest day. sweep: column by column. rows: row by row. spiral: outside in." },
        "weeks": { "type": "integer", "minimum": 4, "maximum": 53, "default": 53 },
        "cell": { "enum": ["square", "round", "triangle", "snowflake", "moon", "hexagon", "mixed"], "default": "square", "description": "Shape of a day. triangle: alternating up / down. hexagon: a honeycomb. snowflake: more contributions, brighter flake. moon: phases from empty to full by contributions. mixed: a random mix of square, round and triangle." },
        "weekStart": { "enum": ["sun", "mon"], "default": "sun" },
        "legend": { "type": "boolean", "default": true },
        "monthLabels": { "type": "boolean", "default": true }
      }
    },
    "export": {
      "type": "object", "additionalProperties": false,
      "properties": { "png": { "type": "boolean", "default": false }, "gif": { "type": "boolean", "default": false } }
    }
  }
}
